{
  "schema_version": "1.0",
  "type": "verified",
  "id": "d-3",
  "theta": "djGKTqNMhkwPUYlP1kshUGNBPk5kODNK+VFaQ6tNjFGLTe9NyT2pSx1MTkg4Sr1BkUtuSxZHjUzKTP1QJk3SS9NKOVA2QzFGyUSsSrBAsFEdSSxL9U1xQmxLqUvjSAhSWEjlSsBIfUkfTs1Ksk8RUb5OSU/bTgxTpkSrKopLrU3bUINNqEjqSc1Q41HnR7RE7DwyTK5PxkWpS9hOWk/oRSdMikxpS+dMEE16UZdMsUl1S7pQVU98SdBF2EavTHpQME67P9FM4kbVUgxMjERuTBpIV0PXPGFO+ziARrxKfVJJSGlK7lA0UB9MKlDoPYVOik22TGtNmlCdSUlEFVSuS5tKikE0UY9NI1GSQptL809CSx1MaUbdSKNHxUhBTMdLnFIHUJlHbUFHTxxImU6jSZ1FLU0OSSRPEEUJUBxPOz7dSJ1NUk4NQeJHukeFUDhHUkjrTTRMM03bTiZNGE3OPXVMcVNBUYdS/E4CU1BLwFB/PBpJwkYpQOtP+kxQQJNNt057RcBGWkYtTDFPLUS+Sz1R6U/EUCBPX0mXSGRKh0vaTExH+EC6QbQ51UfeSx5QwkqgTPNIHD7FScRRWUWaNItNOUcdSwBRmUcmSwhSJ1BiTVpOLUuHRnhCS0jqTEdTZEqZQ0RLrlESRrhMAE1eUPA+C1LoRMdNQ0xJUfBHXFI=",
  "cert": null,
  "iters": 170,
  "ms": 1503.25,
  "stop_reason": "tol",
  "shape": [
    4,
    8,
    8
  ]
}
